id,body,picture,actor,module,time,likes,scenario
1,Listened to taylor's new album and tbh I'm not vibing with it... i think she peaked at midnights and that was it this is thoroughly mid,,melaniemartinez,cyberbullying,-0:43,,har
2,"HaHAHAHAHA I have pics of @Amie being a total idiot yesterday 😂😂
50 likes and I post the photos!! guess what happened",,melaniemartinez,cyberbullying,-0:33,,ot
3,cooked my first batch of kmichi stew!! so excited to try this 👀,kimchi-stew.jpg,hyemincho,cyberbullying,-0:37,,den
4,"Me and the girls had the most amazing birthday party 🥰 thanks for the
everything!!! pics sent to the groupchat  ",party.jpg,hyemincho,cyberbullying,-0:43,,excl